{
  "schema_version": "helix.section-execution-envelope/v1",
  "envelope_id": "ENV-BW-002",
  "run_id": "RUN-SYNTHETIC-001",
  "pinned_run_id": "RUN-SYNTHETIC-001",
  "run_plan_hash": "sha256:1111111111111111111111111111111111111111111111111111111111111111",
  "manifest_hash": "sha256:2222222222222222222222222222222222222222222222222222222222222222",
  "section_package": {
    "package_id": "section.5_2_3_body_weight",
    "version": "0.1.0",
    "path": "skills/helix-evidence-pipeline/packages/sections/5_2_3_body_weight/package.json",
    "hash": "sha256:3333333333333333333333333333333333333333333333333333333333333333"
  },
  "direct_dependencies": [
    {
      "artifact_id": "validation.body_weight",
      "hash": "sha256:4444444444444444444444444444444444444444444444444444444444444444"
    }
  ],
  "validated_claims": [
    {
      "claim_id": "C-CO-TREMOR",
      "field_id": "clinical-observation-incidence",
      "value": 0,
      "unit": "count",
      "grain": "dose_group_x_sex",
      "hash": "sha256:6666666666666666666666666666666666666666666666666666666666666666"
    }
  ],
  "study_context": {
    "study_id": "STUDY-HLX-028",
    "study_type_id": "REPEAT_DOSE_28D_RODENT",
    "group": "high-dose",
    "timepoint": "terminal"
  },
  "structured_failures": [
    {
      "result_id": "VR-011",
      "code": "missing-required-claim",
      "message": "The required claim C-BW-HIGH is not present in this envelope. No terminal body-weight value is available."
    }
  ],
  "executor_receipts": [
    {
      "artifact_id": "EXEC-BW-SUMMARY-001",
      "hash": "sha256:7685e5e4e80f76280e8e1a8a5cc3ec37244a57e83bc43beb4945d3be0c3d7b0f",
      "facts": {
        "recording_days": [
          1,
          7,
          14,
          21,
          28
        ],
        "duration_days": 28,
        "unit": "g",
        "groups": [
          {
            "group_id": "G1",
            "label": "Control",
            "dose": 0.0,
            "dose_unit": "mg/kg/day"
          },
          {
            "group_id": "G2",
            "label": "Low",
            "dose": 10.0,
            "dose_unit": "mg/kg/day"
          },
          {
            "group_id": "G3",
            "label": "Mid",
            "dose": 30.0,
            "dose_unit": "mg/kg/day"
          },
          {
            "group_id": "G4",
            "label": "High",
            "dose": 100.0,
            "dose_unit": "mg/kg/day"
          }
        ],
        "male_means": {
          "G1": {
            "1": 296.5,
            "7": 302.1,
            "14": 310.0,
            "21": 317.2,
            "28": 324.8
          },
          "G2": {
            "1": 295.3,
            "7": 300.8,
            "14": 307.4,
            "21": 315.0,
            "28": 321.4
          },
          "G3": {
            "1": 295.4,
            "7": 300.9,
            "14": 306.6,
            "21": 312.9,
            "28": 319.1
          },
          "G4": {
            "1": 298.1,
            "7": 301.0,
            "14": 305.0,
            "21": 307.4,
            "28": 310.7
          }
        },
        "female_means": {
          "G1": {
            "1": 247.0,
            "7": 252.4,
            "14": 258.2,
            "21": 265.1,
            "28": 271.0
          },
          "G2": {
            "1": 252.1,
            "7": 256.9,
            "14": 263.2,
            "21": 268.8,
            "28": 274.8
          },
          "G3": {
            "1": 248.4,
            "7": 252.8,
            "14": 258.3,
            "21": 263.3,
            "28": 268.1
          },
          "G4": {
            "1": 250.7,
            "7": 253.5,
            "14": 255.9,
            "21": 259.3,
            "28": 261.8
          }
        }
      },
      "provenance": [
        {
          "section_id": "5_2_3_body_weight",
          "claim": "Male G1 Day 1 mean 296.5 g (n=5)",
          "source_record_ids": [
            "BW-HXL-M101-1",
            "BW-HXL-M102-1",
            "BW-HXL-M103-1",
            "BW-HXL-M104-1",
            "BW-HXL-M105-1"
          ],
          "agg": "mean"
        },
        {
          "section_id": "5_2_3_body_weight",
          "claim": "Male G1 Day 7 mean 302.1 g (n=5)",
          "source_record_ids": [
            "BW-HXL-M101-7",
            "BW-HXL-M102-7",
            "BW-HXL-M103-7",
            "BW-HXL-M104-7",
            "BW-HXL-M105-7"
          ],
          "agg": "mean"
        },
        {
          "section_id": "5_2_3_body_weight",
          "claim": "Male G1 Day 14 mean 310.0 g (n=5)",
          "source_record_ids": [
            "BW-HXL-M101-14",
            "BW-HXL-M102-14",
            "BW-HXL-M103-14",
            "BW-HXL-M104-14",
            "BW-HXL-M105-14"
          ],
          "agg": "mean"
        },
        {
          "section_id": "5_2_3_body_weight",
          "claim": "Male G1 Day 21 mean 317.2 g (n=5)",
          "source_record_ids": [
            "BW-HXL-M101-21",
            "BW-HXL-M102-21",
            "BW-HXL-M103-21",
            "BW-HXL-M104-21",
            "BW-HXL-M105-21"
          ],
          "agg": "mean"
        },
        {
          "section_id": "5_2_3_body_weight",
          "claim": "Male G1 Day 28 mean 324.8 g (n=5)",
          "source_record_ids": [
            "BW-HXL-M101-28",
            "BW-HXL-M102-28",
            "BW-HXL-M103-28",
            "BW-HXL-M104-28",
            "BW-HXL-M105-28"
          ],
          "agg": "mean"
        },
        {
          "section_id": "5_2_3_body_weight",
          "claim": "Male G2 Day 1 mean 295.3 g (n=5)",
          "source_record_ids": [
            "BW-HXL-M201-1",
            "BW-HXL-M202-1",
            "BW-HXL-M203-1",
            "BW-HXL-M204-1",
            "BW-HXL-M205-1"
          ],
          "agg": "mean"
        },
        {
          "section_id": "5_2_3_body_weight",
          "claim": "Male G2 Day 7 mean 300.8 g (n=5)",
          "source_record_ids": [
            "BW-HXL-M201-7",
            "BW-HXL-M202-7",
            "BW-HXL-M203-7",
            "BW-HXL-M204-7",
            "BW-HXL-M205-7"
          ],
          "agg": "mean"
        },
        {
          "section_id": "5_2_3_body_weight",
          "claim": "Male G2 Day 14 mean 307.4 g (n=5)",
          "source_record_ids": [
            "BW-HXL-M201-14",
            "BW-HXL-M202-14",
            "BW-HXL-M203-14",
            "BW-HXL-M204-14",
            "BW-HXL-M205-14"
          ],
          "agg": "mean"
        },
        {
          "section_id": "5_2_3_body_weight",
          "claim": "Male G2 Day 21 mean 315.0 g (n=5)",
          "source_record_ids": [
            "BW-HXL-M201-21",
            "BW-HXL-M202-21",
            "BW-HXL-M203-21",
            "BW-HXL-M204-21",
            "BW-HXL-M205-21"
          ],
          "agg": "mean"
        },
        {
          "section_id": "5_2_3_body_weight",
          "claim": "Male G2 Day 28 mean 321.4 g (n=5)",
          "source_record_ids": [
            "BW-HXL-M201-28",
            "BW-HXL-M202-28",
            "BW-HXL-M203-28",
            "BW-HXL-M204-28",
            "BW-HXL-M205-28"
          ],
          "agg": "mean"
        },
        {
          "section_id": "5_2_3_body_weight",
          "claim": "Male G3 Day 1 mean 295.4 g (n=5)",
          "source_record_ids": [
            "BW-HXL-M301-1",
            "BW-HXL-M302-1",
            "BW-HXL-M303-1",
            "BW-HXL-M304-1",
            "BW-HXL-M305-1"
          ],
          "agg": "mean"
        },
        {
          "section_id": "5_2_3_body_weight",
          "claim": "Male G3 Day 7 mean 300.9 g (n=5)",
          "source_record_ids": [
            "BW-HXL-M301-7",
            "BW-HXL-M302-7",
            "BW-HXL-M303-7",
            "BW-HXL-M304-7",
            "BW-HXL-M305-7"
          ],
          "agg": "mean"
        },
        {
          "section_id": "5_2_3_body_weight",
          "claim": "Male G3 Day 14 mean 306.6 g (n=5)",
          "source_record_ids": [
            "BW-HXL-M301-14",
            "BW-HXL-M302-14",
            "BW-HXL-M303-14",
            "BW-HXL-M304-14",
            "BW-HXL-M305-14"
          ],
          "agg": "mean"
        },
        {
          "section_id": "5_2_3_body_weight",
          "claim": "Male G3 Day 21 mean 312.9 g (n=5)",
          "source_record_ids": [
            "BW-HXL-M301-21",
            "BW-HXL-M302-21",
            "BW-HXL-M303-21",
            "BW-HXL-M304-21",
            "BW-HXL-M305-21"
          ],
          "agg": "mean"
        },
        {
          "section_id": "5_2_3_body_weight",
          "claim": "Male G3 Day 28 mean 319.1 g (n=5)",
          "source_record_ids": [
            "BW-HXL-M301-28",
            "BW-HXL-M302-28",
            "BW-HXL-M303-28",
            "BW-HXL-M304-28",
            "BW-HXL-M305-28"
          ],
          "agg": "mean"
        },
        {
          "section_id": "5_2_3_body_weight",
          "claim": "Male G4 Day 1 mean 298.1 g (n=5)",
          "source_record_ids": [
            "BW-HXL-M401-1",
            "BW-HXL-M402-1",
            "BW-HXL-M403-1",
            "BW-HXL-M404-1",
            "BW-HXL-M405-1"
          ],
          "agg": "mean"
        },
        {
          "section_id": "5_2_3_body_weight",
          "claim": "Male G4 Day 7 mean 301.0 g (n=5)",
          "source_record_ids": [
            "BW-HXL-M401-7",
            "BW-HXL-M402-7",
            "BW-HXL-M403-7",
            "BW-HXL-M404-7",
            "BW-HXL-M405-7"
          ],
          "agg": "mean"
        },
        {
          "section_id": "5_2_3_body_weight",
          "claim": "Male G4 Day 14 mean 305.0 g (n=5)",
          "source_record_ids": [
            "BW-HXL-M401-14",
            "BW-HXL-M402-14",
            "BW-HXL-M403-14",
            "BW-HXL-M404-14",
            "BW-HXL-M405-14"
          ],
          "agg": "mean"
        },
        {
          "section_id": "5_2_3_body_weight",
          "claim": "Male G4 Day 21 mean 307.4 g (n=5)",